{
  "$schema": "https://json-schema.org/draft/2020-12/schema",
  "title": "Carestead Benchmark",
  "type": "array",
  "items": {
    "type": "object",
    "required": ["id", "category", "difficulty", "tasks", "events", "memories", "expected"],
    "properties": {
      "id": { "type": "string", "minLength": 1 },
      "category": { "type": "string", "minLength": 1 },
      "difficulty": { "enum": ["easy", "medium", "hard"] },
      "tasks": { "type": "array" },
      "events": { "type": "array" },
      "memories": { "type": "array" },
      "expected": {
        "type": "object",
        "required": ["severity", "approval_required", "action", "evidence"],
        "properties": {
          "severity": { "enum": ["high", "medium", "low"] },
          "approval_required": { "type": "boolean" },
          "action": { "type": "string", "minLength": 1 },
          "evidence": { "type": "array", "items": { "type": "string" }, "minItems": 1 }
        },
        "additionalProperties": false
      }
    },
    "additionalProperties": false
  }
}
