[
  {"id":"med-001","category":"medication","difficulty":"easy","tasks":[{"id":"t1","title":"Pick up refill","owner":"Unassigned","due_at":"2026-09-11T18:00:00-04:00","status":"due_soon","category":"medication","source_risk_id":null}],"events":[{"id":"e1","type":"medication","title":"Refill ready","detail":"Refill ready for pickup","source":"pharmacy","occurred_at":"2026-09-11T09:00:00-04:00"}],"memories":[],"expected":{"severity":"high","approval_required":true,"action":"medication_pickup","evidence":["Pick up refill","Refill ready"]}},
  {"id":"med-002","category":"medication","difficulty":"medium","tasks":[{"id":"t2","title":"Collect new prescription","owner":"Maya","due_at":"2026-09-12T12:00:00-04:00","status":"assigned","category":"medication","source_risk_id":null}],"events":[],"memories":[{"id":"m1","kind":"medication","value":"Maya normally handles pharmacy pickup","source":"caregiver","confidence":"high","status":"verified","updated_at":"2026-09-01T10:00:00-04:00"}],"expected":{"severity":"high","approval_required":true,"action":"medication_pickup","evidence":["Collect new prescription","Maya normally"]}},
  {"id":"med-003","category":"medication","difficulty":"easy","tasks":[{"id":"t3","title":"Morning medication check","owner":"Alex","due_at":"2026-09-11T09:00:00-04:00","status":"complete","category":"medication","source_risk_id":null}],"events":[],"memories":[],"expected":{"severity":"low","approval_required":false,"action":"monitor","evidence":["Medication completion check"]}},
  {"id":"med-004","category":"medication","difficulty":"hard","tasks":[{"id":"t4","title":"Confirm refill status","owner":"Alex","due_at":"2026-09-15T10:00:00-04:00","status":"open","category":"medication","source_risk_id":null}],"events":[{"id":"e4","type":"medication","title":"Refill delayed","detail":"Pharmacy reports a supplier delay","source":"pharmacy","occurred_at":"2026-09-11T10:00:00-04:00"}],"memories":[],"expected":{"severity":"high","approval_required":true,"action":"medication_pickup","evidence":["Confirm refill status","supplier delay"]}},
  {"id":"transport-001","category":"transport","difficulty":"easy","tasks":[{"id":"t5","title":"Arrange ride to physio","owner":"Unassigned","due_at":"2026-09-12T13:00:00-04:00","status":"open","category":"transport","source_risk_id":null}],"events":[],"memories":[],"expected":{"severity":"medium","approval_required":false,"action":"assign_owner","evidence":["Arrange ride to physio"]}},
  {"id":"transport-002","category":"transport","difficulty":"easy","tasks":[{"id":"t6","title":"Ride to cardiology","owner":"Maya","due_at":"2026-09-12T08:30:00-04:00","status":"assigned","category":"transport","source_risk_id":null}],"events":[],"memories":[],"expected":{"severity":"low","approval_required":false,"action":"monitor","evidence":["Task ownership check"]}},
  {"id":"transport-003","category":"transport","difficulty":"hard","tasks":[{"id":"t7","title":"Accessible ride to clinic","owner":"Jordan","due_at":"2026-09-12T08:30:00-04:00","status":"assigned","category":"transport","source_risk_id":null}],"events":[{"id":"e7","type":"availability","title":"Jordan unavailable","detail":"Jordan cannot drive tomorrow","source":"caregiver message","occurred_at":"2026-09-11T18:00:00-04:00"}],"memories":[],"expected":{"severity":"medium","approval_required":false,"action":"reassign_owner","evidence":["Jordan unavailable","Accessible ride"]}},
  {"id":"appointment-001","category":"appointment","difficulty":"medium","tasks":[{"id":"t8","title":"Attend specialist appointment","owner":"Alex","due_at":"2026-09-13T09:30:00-04:00","status":"scheduled","category":"appointment","source_risk_id":null}],"events":[{"id":"e8","type":"appointment","title":"Appointment confirmed","detail":"Specialist confirmed Saturday at 9:30 AM","source":"calendar","occurred_at":"2026-09-11T11:00:00-04:00"}],"memories":[],"expected":{"severity":"low","approval_required":false,"action":"monitor","evidence":["Task ownership check"]}},
  {"id":"appointment-002","category":"appointment","difficulty":"hard","tasks":[{"id":"t9","title":"Cardiology appointment","owner":"Alex","due_at":"2026-09-13T09:30:00-04:00","status":"scheduled","category":"appointment","source_risk_id":null},{"id":"t10","title":"Physiotherapy appointment","owner":"Alex","due_at":"2026-09-13T09:30:00-04:00","status":"scheduled","category":"appointment","source_risk_id":null}],"events":[],"memories":[],"expected":{"severity":"medium","approval_required":false,"action":"resolve_conflict","evidence":["Cardiology appointment","Physiotherapy appointment"]}},
  {"id":"checkin-001","category":"check-in","difficulty":"easy","tasks":[{"id":"t11","title":"Evening wellbeing check-in","owner":"Unassigned","due_at":"2026-09-11T20:00:00-04:00","status":"open","category":"check-in","source_risk_id":null}],"events":[],"memories":[],"expected":{"severity":"medium","approval_required":false,"action":"assign_owner","evidence":["Evening wellbeing check-in"]}},
  {"id":"checkin-002","category":"check-in","difficulty":"hard","tasks":[{"id":"t12","title":"Morning wellbeing check-in","owner":"Maya","due_at":"2026-09-11T09:00:00-04:00","status":"assigned","category":"check-in","source_risk_id":null}],"events":[{"id":"e12","type":"check-in","title":"No response","detail":"No response after two attempts","source":"caregiver log","occurred_at":"2026-09-11T09:45:00-04:00"}],"memories":[],"expected":{"severity":"high","approval_required":true,"action":"escalate_checkin","evidence":["No response"]}},
  {"id":"household-001","category":"household","difficulty":"easy","tasks":[{"id":"t13","title":"Weekly groceries","owner":"Maya","due_at":"2026-09-13T12:00:00-04:00","status":"assigned","category":"household","source_risk_id":null}],"events":[{"id":"e13","type":"household","title":"Delivery confirmed","detail":"Groceries arrive Saturday","source":"receipt","occurred_at":"2026-09-11T10:00:00-04:00"}],"memories":[],"expected":{"severity":"low","approval_required":false,"action":"monitor","evidence":["Task ownership check"]}},
  {"id":"memory-001","category":"memory","difficulty":"medium","tasks":[{"id":"t14","title":"Book accessible transit","owner":"Unassigned","due_at":"2026-09-12T08:00:00-04:00","status":"open","category":"transport","source_risk_id":null}],"events":[],"memories":[{"id":"m14","kind":"transport","value":"Accessible transit requires one-day advance booking","source":"service policy","confidence":"high","status":"verified","updated_at":"2026-09-01T12:00:00-04:00"}],"expected":{"severity":"medium","approval_required":false,"action":"assign_owner","evidence":["Book accessible transit"]}},
  {"id":"memory-002","category":"memory","difficulty":"hard","tasks":[{"id":"t15","title":"Order groceries","owner":"Maya","due_at":"2026-09-13T12:00:00-04:00","status":"assigned","category":"household","source_risk_id":null}],"events":[],"memories":[{"id":"m15","kind":"preference","value":"Old note: avoid all dairy","source":"unverified message","confidence":"low","status":"review_due","updated_at":"2025-01-01T12:00:00-05:00"}],"expected":{"severity":"low","approval_required":false,"action":"review_memory","evidence":["Task ownership check"]}},
  {"id":"noise-001","category":"robustness","difficulty":"hard","tasks":[{"id":"t16","title":"Pick up completed refill","owner":"Maya","due_at":"2026-09-10T18:00:00-04:00","status":"complete","category":"medication","source_risk_id":null}],"events":[{"id":"e16","type":"medication","title":"Old refill ready","detail":"Previously collected refill notification","source":"pharmacy","occurred_at":"2026-08-11T09:00:00-04:00"}],"memories":[],"expected":{"severity":"low","approval_required":false,"action":"monitor","evidence":["Medication completion check"]}},
  {"id":"noise-002","category":"robustness","difficulty":"hard","tasks":[],"events":[{"id":"e17","type":"message","title":"Social update","detail":"Family shared a photo","source":"family message","occurred_at":"2026-09-11T10:00:00-04:00"}],"memories":[],"expected":{"severity":"low","approval_required":false,"action":"monitor","evidence":["Task ownership check"]}}
]
